TwoStage - FOLIO - Started at 20251227_093951
Model: gpt-5
Stage 1 max iterations: 3
Stage 2 max iterations: 3
======================================================================

[09:40:17] Case 33 (s96/e289): True -> True OK PASS s1=1 s2=1 (total: 1)
[09:40:30] Case 104 (s197/e560): True -> True OK PASS s1=1 s2=1 (total: 2)
[09:41:06] Case 105 (s197/e561): True -> True OK PASS s1=1 s2=1 (total: 3)
[09:41:29] Case 177 (s51/e149): True -> Uncertain X PASS s1=1 s2=1 (total: 4)
[09:41:57] Case 34 (s96/e290): Uncertain -> Uncertain OK PASS s1=1 s2=1 (total: 5)
[09:43:27] Case 178 (s259/e703): False -> False OK FAIL@stage2 s1=1 s2=3 (total: 6)
[09:45:46] Case 32 (s340/e895): False -> False OK PASS s1=1 s2=3 (total: 7)
[09:45:47] Case 179 (s152/e442): False -> False OK FAIL@stage2 s1=1 s2=3 (total: 8)
[09:45:55] Case 107 (s361/e958): Uncertain -> Uncertain OK PASS s1=1 s2=1 (total: 9)
[09:46:35] Case 106 (s197/e562): False -> Uncertain X FAIL@stage2 s1=1 s2=3 (total: 10)
[09:47:35] Case 35 (s96/e291): False -> False OK FAIL@stage2 s1=1 s2=3 (total: 11)
[09:48:12] Case 36 (s219/e621): True -> Uncertain X PASS s1=1 s2=1 (total: 12)
[09:48:30] Case 37 (s219/e622): True -> True OK PASS s1=1 s2=1 (total: 13)
[09:48:59] Case 182 (s441/e1269): True -> True OK PASS s1=1 s2=1 (total: 14)
[09:49:25] Case 109 (s361/e960): True -> True OK PASS s1=1 s2=1 (total: 15)
[09:50:31] Case 181 (s441/e1268): Uncertain -> Uncertain OK PASS s1=1 s2=2 (total: 16)
[09:50:44] Case 110 (s262/e706): Uncertain -> Uncertain OK PASS s1=1 s2=1 (total: 17)
[09:51:31] Case 180 (s152/e443): False -> False OK FAIL@stage2 s1=1 s2=3 (total: 18)
[09:51:41] Case 108 (s361/e959): False -> False OK FAIL@stage2 s1=1 s2=3 (total: 19)
[09:52:33] Case 39 (s350/e927): Uncertain -> Uncertain OK PASS s1=1 s2=1 (total: 20)
[09:52:46] Case 111 (s124/e370): True -> True OK PASS s1=1 s2=1 (total: 21)
[09:54:27] Case 112 (s124/e371): Uncertain -> False X PASS s1=1 s2=1 (total: 22)
[09:54:46] Case 184 (s64/e189): True -> Uncertain X PASS s1=1 s2=2 (total: 23)
[09:55:50] Case 183 (s441/e1270): False -> False OK FAIL@stage2 s1=1 s2=3 (total: 24)
[09:56:12] Case 40 (s350/e928): True -> Uncertain X PASS s1=1 s2=2 (total: 25)
[09:56:13] Case 185 (s64/e190): False -> False OK PASS s1=1 s2=1 (total: 26)
[09:56:19] Case 38 (s219/e623): False -> False OK FAIL@stage2 s1=1 s2=3 (total: 27)
[09:57:30] Case 42 (s385/e1029): True -> True OK PASS s1=1 s2=1 (total: 28)
[09:58:09] Case 186 (s64/e191): Uncertain -> Uncertain OK PASS s1=1 s2=1 (total: 29)
[09:59:33] Case 187 (s456/e1313): Uncertain -> Uncertain OK PASS s1=1 s2=1 (total: 30)
[10:01:34] Case 115 (s183/e528): True -> True OK PASS s1=1 s2=2 (total: 31)
[10:01:36] Case 41 (s350/e929): False -> Uncertain X FAIL@stage2 s1=1 s2=3 (total: 32)
[10:02:16] Case 188 (s456/e1314): True -> True OK PASS s1=1 s2=1 (total: 33)
[10:04:40] Case 116 (s183/e529): Uncertain -> False X PASS s1=1 s2=1 (total: 34)
[10:04:52] Case 43 (s385/e1030): Uncertain -> Uncertain OK PASS s1=1 s2=3 (total: 35)
[10:05:31] Case 114 (s183/e527): False -> False OK PASS s1=2 s2=3 (total: 36)
[10:06:59] Case 45 (s256/e700): Uncertain -> False X PASS s1=1 s2=1 (total: 37)
[10:07:00] Case 113 (s124/e372): False -> False OK FAIL@stage2 s1=1 s2=3 (total: 38)
[10:08:42] Case 117 (s151/e439): Uncertain -> Uncertain OK PASS s1=1 s2=2 (total: 39)
[10:08:55] Case 44 (s385/e1031): False -> False OK FAIL@stage2 s1=1 s2=3 (total: 40)
[10:10:59] Case 189 (s456/e1315): False -> False OK FAIL@stage2 s1=1 s2=3 (total: 41)
[10:11:25] Case 118 (s151/e440): True -> Uncertain X PASS s1=1 s2=1 (total: 42)
[10:11:54] Case 46 (s159/e456): True -> Uncertain X PASS s1=1 s2=2 (total: 43)
[10:13:11] Case 192 (s280/e724): False -> False OK PASS s1=1 s2=1 (total: 44)
[10:13:15] Case 191 (s456/e1317): False -> False OK FAIL@stage2 s1=1 s2=3 (total: 45)
[10:13:47] Case 190 (s456/e1316): False -> False OK FAIL@stage2 s1=1 s2=3 (total: 46)
[10:14:03] Case 120 (s295/e739): Uncertain -> Uncertain OK PASS s1=1 s2=1 (total: 47)
[10:15:10] Case 48 (s343/e904): Uncertain -> False X PASS s1=1 s2=1 (total: 48)
[10:15:22] Case 119 (s151/e441): False -> Uncertain X PASS s1=1 s2=3 (total: 49)
[10:16:12] Case 49 (s343/e905): False -> False OK PASS s1=1 s2=1 (total: 50)
[10:16:43] Case 50 (s343/e906): True -> True OK PASS s1=1 s2=1 (total: 51)
[10:16:59] Case 121 (s315/e786): Uncertain -> Uncertain OK PASS s1=1 s2=1 (total: 52)
[10:18:14] Case 47 (s159/e457): Uncertain -> Uncertain OK FAIL@stage2 s1=1 s2=3 (total: 53)
[10:18:28] Case 122 (s315/e787): False -> False OK PASS s1=1 s2=1 (total: 54)
[10:18:59] Case 195 (s459/e1324): Uncertain -> Uncertain OK PASS s1=1 s2=1 (total: 55)
[10:19:19] Case 194 (s140/e412): Uncertain -> Uncertain OK PASS s1=1 s2=2 (total: 56)
[10:19:41] Case 193 (s140/e411): False -> False OK FAIL@stage2 s1=1 s2=3 (total: 57)
[10:21:27] Case 52 (s213/e609): Uncertain -> Uncertain OK PASS s1=1 s2=1 (total: 58)
[10:21:32] Case 51 (s213/e608): False -> Uncertain X PASS s1=1 s2=1 (total: 59)
[10:22:31] Case 53 (s213/e610): True -> True OK PASS s1=1 s2=1 (total: 60)
[10:22:42] Case 196 (s459/e1325): False -> False OK PASS s1=1 s2=1 (total: 61)
[10:23:49] Case 125 (s467/e1349): True -> True OK PASS s1=1 s2=1 (total: 62)
[10:24:08] Case 197 (s459/e1326): True -> True OK PASS s1=1 s2=1 (total: 63)
[10:24:36] Case 123 (s315/e788): True -> Uncertain X PASS s1=1 s2=3 (total: 64)
[10:24:45] Case 54 (s79/e240): True -> True OK PASS s1=1 s2=1 (total: 65)
[10:26:28] Case 55 (s79/e241): False -> False OK PASS s1=1 s2=1 (total: 66)
[10:27:17] Case 198 (s101/e304): False -> False OK PASS s1=1 s2=2 (total: 67)
[10:29:39] Case 124 (s467/e1348): Uncertain -> Uncertain OK FAIL@stage2 s1=1 s2=3 (total: 68)
[10:30:04] Case 127 (s330/e846): False -> Uncertain X PASS s1=1 s2=1 (total: 69)
[10:31:52] Case 56 (s79/e242): Uncertain -> Uncertain OK PASS s1=1 s2=1 (total: 70)
[10:32:18] Case 199 (s101/e305): False -> False OK PASS s1=1 s2=2 (total: 71)
[10:34:32] Case 200 (s101/e306): False -> False OK FAIL@stage2 s1=1 s2=3 (total: 72)
[10:34:45] Case 126 (s467/e1350): False -> False OK FAIL@stage2 s1=1 s2=3 (total: 73)
[10:34:54] Case 201 (s101/e307): Uncertain -> Uncertain OK PASS s1=1 s2=1 (total: 74)
[10:36:34] Case 57 (s2/e4): False -> False OK PASS s1=1 s2=1 (total: 75)
[10:37:12] Case 202 (s101/e308): Uncertain -> True X PASS s1=1 s2=1 (total: 76)
[10:39:48] Case 58 (s2/e5): Uncertain -> Uncertain OK PASS s1=1 s2=1 (total: 77)
[10:40:08] Case 130 (s330/e849): True -> False X PASS s1=1 s2=1 (total: 78)
[10:40:44] Case 131 (s26/e74): True -> True OK PASS s1=1 s2=1 (total: 79)
[10:42:06] Case 129 (s330/e848): Uncertain -> Uncertain OK PASS s1=1 s2=2 (total: 80)
[10:42:28] Case 59 (s2/e6): True -> True OK PASS s1=1 s2=1 (total: 81)
[10:44:00] Case 128 (s330/e847): True -> Uncertain X FAIL@stage2 s1=1 s2=3 (total: 82)
[10:45:18] Case 61 (s192/e549): Uncertain -> Uncertain OK PASS s1=1 s2=1 (total: 83)
[10:45:34] Case 176 (s51/e148): False -> False OK FAIL@stage2 s1=1 s2=3 (total: 84)
[10:46:04] Case 134 (s203/e578): True -> True OK PASS s1=1 s2=1 (total: 85)
[10:47:08] Case 62 (s442/e1271): Uncertain -> False X PASS s1=1 s2=1 (total: 86)
[10:47:38] Case 133 (s26/e76): Uncertain -> False X PASS s1=1 s2=1 (total: 87)
[10:47:56] Case 132 (s26/e75): Uncertain -> False X PASS s1=1 s2=2 (total: 88)
[10:48:16] Case 63 (s442/e1272): False -> False OK PASS s1=1 s2=1 (total: 89)
[10:48:20] Case 64 (s442/e1273): True -> True OK PASS s1=1 s2=1 (total: 90)
[10:50:30] Case 65 (s234/e663): True -> True OK PASS s1=1 s2=1 (total: 91)
[10:50:40] Case 135 (s203/e579): Uncertain -> Uncertain OK PASS s1=1 s2=1 (total: 92)
[10:51:01] Case 137 (s131/e388): True -> True OK PASS s1=1 s2=1 (total: 93)
[10:52:19] Case 67 (s234/e665): True -> True OK PASS s1=1 s2=1 (total: 94)
[10:53:26] Case 136 (s203/e580): False -> False OK PASS s1=1 s2=1 (total: 95)
[10:53:27] Case 60 (s192/e548): Uncertain -> Uncertain OK PASS s1=1 s2=3 (total: 96)
[10:53:27] Case 66 (s234/e664): Uncertain -> Uncertain OK PASS s1=1 s2=1 (total: 97)
[10:54:56] Case 68 (s120/e360): True -> True OK PASS s1=1 s2=1 (total: 98)
[11:05:23] Case 141 (s460/e1329): True -> None X FAIL@exception s1=1 s2=0 (total: 99)
[11:05:23] Case 70 (s322/e819): Uncertain -> None X FAIL@exception s1=0 s2=0 (total: 100)
[11:05:23] Case 142 (s46/e133): True -> None X FAIL@exception s1=0 s2=0 (total: 101)
[11:05:23] Case 71 (s322/e820): False -> None X FAIL@exception s1=0 s2=0 (total: 102)
[11:05:23] Case 143 (s46/e134): Uncertain -> None X FAIL@exception s1=0 s2=0 (total: 103)
[11:05:23] Case 72 (s322/e821): True -> None X FAIL@exception s1=0 s2=0 (total: 104)
[11:05:23] Case 144 (s483/e1410): Uncertain -> None X FAIL@exception s1=0 s2=0 (total: 105)
[11:05:23] Case 73 (s83/e253): True -> None X FAIL@exception s1=0 s2=0 (total: 106)
[11:05:23] Case 0 (s380/e1014): Uncertain -> None X FAIL@exception s1=0 s2=0 (total: 107)
[11:05:23] Case 145 (s483/e1411): Uncertain -> None X FAIL@exception s1=0 s2=0 (total: 108)
[11:05:23] Case 74 (s83/e254): False -> None X FAIL@exception s1=0 s2=0 (total: 109)
[11:05:23] Case 1 (s380/e1015): True -> None X FAIL@exception s1=0 s2=0 (total: 110)
[11:05:23] Case 146 (s483/e1412): True -> None X FAIL@exception s1=0 s2=0 (total: 111)
[11:05:23] Case 75 (s368/e979): Uncertain -> None X FAIL@exception s1=0 s2=0 (total: 112)
[11:05:23] Case 2 (s380/e1016): False -> None X FAIL@exception s1=0 s2=0 (total: 113)
[11:05:23] Case 147 (s483/e1413): True -> None X FAIL@exception s1=0 s2=0 (total: 114)
[11:05:23] Case 76 (s368/e980): True -> None X FAIL@exception s1=0 s2=0 (total: 115)
[11:05:23] Case 3 (s426/e1208): Uncertain -> None X FAIL@exception s1=0 s2=0 (total: 116)
[11:05:23] Case 148 (s483/e1414): False -> None X FAIL@exception s1=0 s2=0 (total: 117)
[11:05:23] Case 77 (s368/e981): False -> None X FAIL@exception s1=0 s2=0 (total: 118)
[11:05:23] Case 4 (s426/e1209): Uncertain -> None X FAIL@exception s1=0 s2=0 (total: 119)
[11:05:23] Case 149 (s80/e243): True -> None X FAIL@exception s1=0 s2=0 (total: 120)
[11:05:23] Case 78 (s319/e805): False -> None X FAIL@exception s1=0 s2=0 (total: 121)
[11:05:23] Case 5 (s426/e1210): True -> None X FAIL@exception s1=0 s2=0 (total: 122)
[11:05:23] Case 150 (s80/e244): Uncertain -> None X FAIL@exception s1=0 s2=0 (total: 123)
[11:05:23] Case 79 (s319/e806): True -> None X FAIL@exception s1=0 s2=0 (total: 124)
[11:05:23] Case 6 (s198/e563): True -> None X FAIL@exception s1=0 s2=0 (total: 125)
[11:05:23] Case 151 (s80/e245): Uncertain -> None X FAIL@exception s1=0 s2=0 (total: 126)
[11:05:23] Case 80 (s319/e807): Uncertain -> None X FAIL@exception s1=0 s2=0 (total: 127)
[11:05:23] Case 7 (s198/e564): Uncertain -> None X FAIL@exception s1=0 s2=0 (total: 128)
[11:05:23] Case 152 (s363/e964): Uncertain -> None X FAIL@exception s1=0 s2=0 (total: 129)
[11:05:23] Case 81 (s319/e808): True -> None X FAIL@exception s1=0 s2=0 (total: 130)
[11:05:23] Case 8 (s198/e565): Uncertain -> None X FAIL@exception s1=0 s2=0 (total: 131)
[11:05:23] Case 153 (s363/e965): False -> None X FAIL@exception s1=0 s2=0 (total: 132)
[11:05:23] Case 82 (s319/e809): False -> None X FAIL@exception s1=0 s2=0 (total: 133)
[11:05:23] Case 9 (s0/e0): True -> None X FAIL@exception s1=0 s2=0 (total: 134)
[11:05:23] Case 154 (s363/e966): True -> None X FAIL@exception s1=0 s2=0 (total: 135)
[11:05:23] Case 83 (s306/e754): False -> None X FAIL@exception s1=0 s2=0 (total: 136)
[11:05:23] Case 10 (s0/e1): False -> None X FAIL@exception s1=0 s2=0 (total: 137)
[11:05:23] Case 155 (s258/e702): Uncertain -> None X FAIL@exception s1=0 s2=0 (total: 138)
[11:05:23] Case 84 (s306/e755): True -> None X FAIL@exception s1=0 s2=0 (total: 139)
[11:05:23] Case 11 (s0/e2): Uncertain -> None X FAIL@exception s1=0 s2=0 (total: 140)
[11:05:23] Case 156 (s435/e1244): False -> None X FAIL@exception s1=0 s2=0 (total: 141)
[11:05:23] Case 85 (s306/e756): Uncertain -> None X FAIL@exception s1=0 s2=0 (total: 142)
[11:05:23] Case 12 (s20/e57): True -> None X FAIL@exception s1=0 s2=0 (total: 143)
[11:05:23] Case 157 (s435/e1245): True -> None X FAIL@exception s1=0 s2=0 (total: 144)
[11:05:23] Case 86 (s245/e688): True -> None X FAIL@exception s1=0 s2=0 (total: 145)
[11:05:23] Case 13 (s20/e58): Uncertain -> None X FAIL@exception s1=0 s2=0 (total: 146)
[11:05:23] Case 158 (s435/e1246): True -> None X FAIL@exception s1=0 s2=0 (total: 147)
[11:05:23] Case 87 (s58/e171): True -> None X FAIL@exception s1=0 s2=0 (total: 148)
[11:05:23] Case 14 (s20/e59): False -> None X FAIL@exception s1=0 s2=0 (total: 149)
[11:05:23] Case 159 (s435/e1247): Uncertain -> None X FAIL@exception s1=0 s2=0 (total: 150)
[11:05:23] Case 88 (s58/e172): True -> None X FAIL@exception s1=0 s2=0 (total: 151)
[11:05:23] Case 15 (s282/e726): True -> None X FAIL@exception s1=0 s2=0 (total: 152)
[11:05:23] Case 160 (s217/e618): True -> None X FAIL@exception s1=0 s2=0 (total: 153)
[11:05:23] Case 89 (s58/e173): Uncertain -> None X FAIL@exception s1=0 s2=0 (total: 154)
[11:05:23] Case 16 (s471/e1361): Uncertain -> None X FAIL@exception s1=0 s2=0 (total: 155)
[11:05:23] Case 161 (s217/e619): Uncertain -> None X FAIL@exception s1=0 s2=0 (total: 156)
[11:05:23] Case 90 (s191/e546): True -> None X FAIL@exception s1=0 s2=0 (total: 157)
[11:05:23] Case 17 (s471/e1362): Uncertain -> None X FAIL@exception s1=0 s2=0 (total: 158)
[11:05:23] Case 162 (s292/e736): False -> None X FAIL@exception s1=0 s2=0 (total: 159)
[11:05:23] Case 91 (s191/e547): False -> None X FAIL@exception s1=0 s2=0 (total: 160)
[11:05:23] Case 18 (s471/e1363): True -> None X FAIL@exception s1=0 s2=0 (total: 161)
[11:05:23] Case 163 (s318/e802): Uncertain -> None X FAIL@exception s1=0 s2=0 (total: 162)
[11:05:23] Case 92 (s166/e476): False -> None X FAIL@exception s1=0 s2=0 (total: 163)
[11:05:23] Case 19 (s471/e1364): True -> None X FAIL@exception s1=0 s2=0 (total: 164)
[11:05:23] Case 164 (s318/e803): False -> None X FAIL@exception s1=0 s2=0 (total: 165)
[11:05:23] Case 93 (s166/e477): Uncertain -> None X FAIL@exception s1=0 s2=0 (total: 166)
[11:05:23] Case 20 (s471/e1365): False -> None X FAIL@exception s1=0 s2=0 (total: 167)
[11:05:23] Case 165 (s318/e804): True -> None X FAIL@exception s1=0 s2=0 (total: 168)
[11:05:23] Case 94 (s166/e478): True -> None X FAIL@exception s1=0 s2=0 (total: 169)
[11:05:23] Case 21 (s184/e530): True -> None X FAIL@exception s1=0 s2=0 (total: 170)
[11:05:23] Case 166 (s107/e323): True -> None X FAIL@exception s1=0 s2=0 (total: 171)
[11:05:23] Case 95 (s352/e933): Uncertain -> None X FAIL@exception s1=0 s2=0 (total: 172)
[11:05:23] Case 22 (s184/e531): False -> None X FAIL@exception s1=0 s2=0 (total: 173)
[11:05:23] Case 167 (s107/e324): True -> None X FAIL@exception s1=0 s2=0 (total: 174)
[11:05:23] Case 96 (s352/e934): False -> None X FAIL@exception s1=0 s2=0 (total: 175)
[11:05:23] Case 23 (s184/e532): Uncertain -> None X FAIL@exception s1=0 s2=0 (total: 176)
[11:05:23] Case 168 (s107/e325): False -> None X FAIL@exception s1=0 s2=0 (total: 177)
[11:05:23] Case 97 (s352/e935): True -> None X FAIL@exception s1=0 s2=0 (total: 178)
[11:05:23] Case 24 (s232/e657): True -> None X FAIL@exception s1=0 s2=0 (total: 179)
[11:05:23] Case 169 (s386/e1032): Uncertain -> None X FAIL@exception s1=0 s2=0 (total: 180)
[11:05:23] Case 98 (s472/e1366): Uncertain -> None X FAIL@exception s1=0 s2=0 (total: 181)
[11:05:23] Case 25 (s232/e658): Uncertain -> None X FAIL@exception s1=0 s2=0 (total: 182)
[11:05:23] Case 170 (s386/e1033): True -> None X FAIL@exception s1=0 s2=0 (total: 183)
[11:05:23] Case 99 (s472/e1367): True -> None X FAIL@exception s1=0 s2=0 (total: 184)
[11:05:24] Case 26 (s232/e659): Uncertain -> None X FAIL@exception s1=0 s2=0 (total: 185)
[11:05:24] Case 171 (s386/e1034): False -> None X FAIL@exception s1=0 s2=0 (total: 186)
[11:05:24] Case 100 (s472/e1368): False -> None X FAIL@exception s1=0 s2=0 (total: 187)
[11:05:24] Case 27 (s452/e1301): Uncertain -> None X FAIL@exception s1=0 s2=0 (total: 188)
[11:05:24] Case 172 (s355/e941): Uncertain -> None X FAIL@exception s1=0 s2=0 (total: 189)
[11:05:24] Case 101 (s379/e1011): Uncertain -> None X FAIL@exception s1=0 s2=0 (total: 190)
[11:05:24] Case 28 (s452/e1302): True -> None X FAIL@exception s1=0 s2=0 (total: 191)
[11:05:24] Case 173 (s355/e942): False -> None X FAIL@exception s1=0 s2=0 (total: 192)
[11:05:24] Case 102 (s379/e1012): False -> None X FAIL@exception s1=0 s2=0 (total: 193)
[11:05:24] Case 29 (s452/e1303): False -> None X FAIL@exception s1=0 s2=0 (total: 194)
[11:05:24] Case 174 (s355/e943): True -> None X FAIL@exception s1=0 s2=0 (total: 195)
[11:05:24] Case 103 (s379/e1013): True -> None X FAIL@exception s1=0 s2=0 (total: 196)
[11:05:24] Case 30 (s340/e893): Uncertain -> None X FAIL@exception s1=0 s2=0 (total: 197)
[11:05:24] Case 175 (s51/e147): Uncertain -> None X FAIL@exception s1=0 s2=0 (total: 198)
[11:05:24] Case 31 (s340/e894): True -> None X FAIL@exception s1=0 s2=0 (total: 199)
[11:05:30] Case 139 (s460/e1327): Uncertain -> None X FAIL@exception s1=1 s2=0 (total: 200)
[11:06:43] Case 69 (s120/e361): False -> None X FAIL@exception s1=1 s2=0 (total: 201)
[11:06:51] Case 140 (s460/e1328): False -> None X FAIL@exception s1=1 s2=0 (total: 202)
[11:07:03] Case 138 (s131/e389): False -> None X FAIL@exception s1=1 s2=0 (total: 203)

======================================================================
FINAL RESULTS
======================================================================

Total: 203
Accuracy: 76/203 (37.4%)
Stage 1 Success: 103/203 (50.7%)
Stage 2 Success: 77/103 (74.8%)
Stage 1 Failures: 0
Stage 2 Failures: 21

Completed at: 2025-12-27 11:07:03

======================================================================
RESUMED at 20251227_113610
======================================================================

[11:36:55] Case 90 (s191/e546): True -> True OK PASS s1=2 s2=1 (total: 99)
[11:39:07] Case 92 (s166/e476): False -> Uncertain X PASS s1=1 s2=1 (total: 100)
[11:39:14] Case 94 (s166/e478): True -> True OK PASS s1=2 s2=1 (total: 101)
[11:39:30] Case 93 (s166/e477): Uncertain -> Uncertain OK PASS s1=1 s2=1 (total: 102)
[11:39:54] Case 97 (s352/e935): True -> True OK PASS s1=1 s2=1 (total: 103)
[11:40:48] Case 95 (s352/e933): Uncertain -> Uncertain OK PASS s1=1 s2=1 (total: 104)
[11:41:16] Case 91 (s191/e547): False -> Uncertain X FAIL@stage2 s1=1 s2=3 (total: 105)
[11:41:24] Case 96 (s352/e934): False -> False OK PASS s1=1 s2=1 (total: 106)
[11:41:27] Case 98 (s472/e1366): Uncertain -> Uncertain OK PASS s1=1 s2=1 (total: 107)
[11:41:33] Case 89 (s58/e173): Uncertain -> False X PASS s1=1 s2=3 (total: 108)
[11:42:53] Case 99 (s472/e1367): True -> Uncertain X PASS s1=1 s2=1 (total: 109)
[11:46:27] Case 138 (s131/e389): False -> Uncertain X PASS s1=1 s2=1 (total: 110)
[11:47:55] Case 102 (s379/e1012): False -> Uncertain X PASS s1=1 s2=3 (total: 111)
[11:50:19] Case 100 (s472/e1368): False -> False OK FAIL@stage2 s1=1 s2=3 (total: 112)
[11:50:51] Case 103 (s379/e1013): True -> False X PASS s1=1 s2=3 (total: 113)
[11:51:29] Case 101 (s379/e1011): Uncertain -> Uncertain OK FAIL@stage2 s1=1 s2=3 (total: 114)
[11:51:56] Case 140 (s460/e1328): False -> Uncertain X PASS s1=1 s2=2 (total: 115)
[11:52:29] Case 142 (s46/e133): True -> True OK PASS s1=1 s2=1 (total: 116)
[11:53:24] Case 141 (s460/e1329): True -> Uncertain X PASS s1=1 s2=1 (total: 117)
[11:53:49] Case 139 (s460/e1327): Uncertain -> Uncertain OK PASS s1=1 s2=3 (total: 118)
[11:54:37] Case 143 (s46/e134): Uncertain -> Uncertain OK PASS s1=1 s2=1 (total: 119)
[11:54:51] Case 0 (s380/e1014): Uncertain -> Uncertain OK PASS s1=1 s2=1 (total: 120)
[11:55:38] Case 1 (s380/e1015): True -> True OK PASS s1=1 s2=2 (total: 121)
[11:56:28] Case 2 (s380/e1016): False -> Uncertain X PASS s1=1 s2=1 (total: 122)
[11:56:43] Case 146 (s483/e1412): True -> True OK PASS s1=1 s2=1 (total: 123)
[11:57:02] Case 3 (s426/e1208): Uncertain -> Uncertain OK PASS s1=1 s2=1 (total: 124)
[11:57:45] Case 147 (s483/e1413): True -> True OK PASS s1=1 s2=1 (total: 125)
[11:57:56] Case 144 (s483/e1410): Uncertain -> Uncertain OK PASS s1=1 s2=3 (total: 126)
[11:58:46] Case 6 (s198/e563): True -> True OK PASS s1=1 s2=1 (total: 127)
[11:59:07] Case 5 (s426/e1210): True -> Uncertain X PASS s1=1 s2=1 (total: 128)
[11:59:14] Case 149 (s80/e243): True -> True OK PASS s1=1 s2=1 (total: 129)
[12:00:37] Case 145 (s483/e1411): Uncertain -> Uncertain OK FAIL@stage2 s1=1 s2=3 (total: 130)
[12:01:55] Case 150 (s80/e244): Uncertain -> Uncertain OK PASS s1=1 s2=2 (total: 131)
[12:02:35] Case 8 (s198/e565): Uncertain -> False X PASS s1=1 s2=1 (total: 132)
[12:02:47] Case 4 (s426/e1209): Uncertain -> Uncertain OK FAIL@stage2 s1=1 s2=3 (total: 133)
[12:03:14] Case 151 (s80/e245): Uncertain -> Uncertain OK PASS s1=1 s2=1 (total: 134)
[12:03:25] Case 9 (s0/e0): True -> True OK PASS s1=1 s2=1 (total: 135)
[12:03:57] Case 148 (s483/e1414): False -> False OK FAIL@stage2 s1=1 s2=3 (total: 136)
[12:04:01] Case 7 (s198/e564): Uncertain -> Uncertain OK FAIL@stage2 s1=1 s2=3 (total: 137)
[12:04:55] Case 154 (s363/e966): True -> True OK PASS s1=1 s2=1 (total: 138)
