TwoStage - FOLIO - Started at 20251226_232342
Model: deepseek-r1
Stage 1 max iterations: 3
Stage 2 max iterations: 3
======================================================================

[23:25:03] Case 34 (s96/e290): Uncertain -> True X PASS s1=1 s2=1 (total: 1)
[23:25:35] Case 33 (s96/e289): True -> True OK PASS s1=1 s2=1 (total: 2)
[23:27:30] Case 105 (s197/e561): True -> True OK PASS s1=3 s2=1 (total: 3)
[23:30:08] Case 178 (s259/e703): False -> False OK PASS s1=1 s2=2 (total: 4)
[23:32:24] Case 107 (s361/e958): Uncertain -> False X PASS s1=1 s2=1 (total: 5)
[23:32:35] Case 180 (s152/e443): False -> Uncertain X PASS s1=1 s2=1 (total: 6)
[23:34:30] Case 36 (s219/e621): True -> Uncertain X PASS s1=1 s2=1 (total: 7)
[23:37:11] Case 181 (s441/e1268): Uncertain -> False X PASS s1=1 s2=1 (total: 8)
[23:37:36] Case 179 (s152/e442): False -> False OK FAIL@stage2 s1=1 s2=3 (total: 9)
[23:38:34] Case 35 (s96/e291): False -> Uncertain X PASS s1=1 s2=2 (total: 10)
[23:38:46] Case 109 (s361/e960): True -> True OK PASS s1=1 s2=1 (total: 11)
[23:38:46] Case 106 (s197/e562): False -> True X FAIL@stage2 s1=1 s2=3 (total: 12)
[23:39:12] Case 37 (s219/e622): True -> True OK PASS s1=1 s2=1 (total: 13)
[23:39:45] Case 182 (s441/e1269): True -> True OK PASS s1=1 s2=1 (total: 14)
[23:41:15] Case 110 (s262/e706): Uncertain -> Uncertain OK PASS s1=1 s2=1 (total: 15)
[23:44:16] Case 111 (s124/e370): True -> True OK PASS s1=1 s2=1 (total: 16)
[23:44:39] Case 39 (s350/e927): Uncertain -> False X PASS s1=1 s2=1 (total: 17)
[23:47:32] Case 183 (s441/e1270): False -> False OK FAIL@stage2 s1=1 s2=3 (total: 18)
[23:47:51] Case 184 (s64/e189): True -> False X PASS s1=1 s2=1 (total: 19)
[23:49:21] Case 40 (s350/e928): True -> Uncertain X PASS s1=1 s2=1 (total: 20)
[23:50:44] Case 108 (s361/e959): False -> True X FAIL@stage2 s1=1 s2=3 (total: 21)
[23:51:18] Case 38 (s219/e623): False -> False OK FAIL@stage2 s1=1 s2=3 (total: 22)
[23:54:21] Case 186 (s64/e191): Uncertain -> Uncertain OK PASS s1=1 s2=1 (total: 23)
[23:54:22] Case 41 (s350/e929): False -> True X PASS s1=1 s2=1 (total: 24)
[23:55:47] Case 185 (s64/e190): False -> False OK FAIL@stage2 s1=1 s2=3 (total: 25)
[23:57:25] Case 42 (s385/e1029): True -> True OK PASS s1=1 s2=1 (total: 26)
[23:58:42] Case 112 (s124/e371): Uncertain -> Uncertain OK PASS s1=1 s2=3 (total: 27)
[23:59:17] Case 43 (s385/e1030): Uncertain -> Uncertain OK PASS s1=1 s2=1 (total: 28)
[23:59:35] Case 187 (s456/e1313): Uncertain -> Uncertain OK PASS s1=1 s2=1 (total: 29)
[00:00:58] Case 188 (s456/e1314): True -> True OK PASS s1=1 s2=1 (total: 30)
[00:01:41] Case 113 (s124/e372): False -> Uncertain X FAIL@stage2 s1=1 s2=3 (total: 31)
[00:03:21] Case 44 (s385/e1031): False -> Uncertain X PASS s1=1 s2=1 (total: 32)
[00:05:23] Case 114 (s183/e527): False -> Uncertain X FAIL@stage2 s1=1 s2=3 (total: 33)
[00:05:27] Case 115 (s183/e528): True -> True OK PASS s1=1 s2=3 (total: 34)
[00:06:23] Case 45 (s256/e700): Uncertain -> Uncertain OK PASS s1=1 s2=1 (total: 35)
[00:06:28] Case 116 (s183/e529): Uncertain -> Uncertain OK PASS s1=1 s2=1 (total: 36)
[00:07:35] Case 46 (s159/e456): True -> True OK PASS s1=1 s2=1 (total: 37)
[00:07:43] Case 189 (s456/e1315): False -> False OK PASS s1=1 s2=2 (total: 38)
[00:08:28] Case 117 (s151/e439): Uncertain -> Uncertain OK PASS s1=1 s2=1 (total: 39)
[00:10:34] Case 119 (s151/e441): False -> Uncertain X PASS s1=1 s2=1 (total: 40)
[00:14:23] Case 190 (s456/e1316): False -> False OK FAIL@stage2 s1=1 s2=3 (total: 41)
[00:14:57] Case 192 (s280/e724): False -> Uncertain X PASS s1=1 s2=1 (total: 42)
[00:17:25] Case 120 (s295/e739): Uncertain -> False X PASS s1=1 s2=1 (total: 43)
[00:17:46] Case 47 (s159/e457): Uncertain -> Uncertain OK FAIL@stage2 s1=1 s2=3 (total: 44)
[00:17:55] Case 118 (s151/e440): True -> Uncertain X PASS s1=2 s2=2 (total: 45)
[00:19:46] Case 48 (s343/e904): Uncertain -> False X PASS s1=1 s2=1 (total: 46)
[00:21:13] Case 121 (s315/e786): Uncertain -> Uncertain OK PASS s1=1 s2=1 (total: 47)
[00:22:35] Case 49 (s343/e905): False -> False OK PASS s1=1 s2=1 (total: 48)
[00:23:53] Case 50 (s343/e906): True -> True OK PASS s1=1 s2=2 (total: 49)
[00:24:11] Case 191 (s456/e1317): False -> False OK FAIL@stage2 s1=1 s2=3 (total: 50)
[00:27:41] Case 122 (s315/e787): False -> False OK PASS s1=1 s2=1 (total: 51)
[00:28:06] Case 193 (s140/e411): False -> True X FAIL@stage2 s1=1 s2=3 (total: 52)
[00:29:18] Case 194 (s140/e412): Uncertain -> Uncertain OK PASS s1=1 s2=2 (total: 53)
[00:30:52] Case 195 (s459/e1324): Uncertain -> Uncertain OK PASS s1=1 s2=1 (total: 54)
[00:32:00] Case 124 (s467/e1348): Uncertain -> Uncertain OK PASS s1=1 s2=1 (total: 55)
[00:32:22] Case 196 (s459/e1325): False -> False OK PASS s1=1 s2=1 (total: 56)
[00:33:21] Case 123 (s315/e788): True -> True OK PASS s1=1 s2=1 (total: 57)
[00:35:02] Case 52 (s213/e609): Uncertain -> Uncertain OK PASS s1=1 s2=1 (total: 58)
[00:35:08] Case 125 (s467/e1349): True -> True OK PASS s1=1 s2=1 (total: 59)
[00:36:25] Case 54 (s79/e240): True -> True OK PASS s1=1 s2=1 (total: 60)
[00:36:56] Case 53 (s213/e610): True -> True OK PASS s1=2 s2=2 (total: 61)
[00:40:40] Case 198 (s101/e304): False -> False OK PASS s1=2 s2=1 (total: 62)
[00:41:06] Case 197 (s459/e1326): True -> True OK FAIL@stage2 s1=1 s2=3 (total: 63)
[00:41:53] Case 51 (s213/e608): False -> Uncertain X PASS s1=1 s2=3 (total: 64)
[00:43:43] Case 199 (s101/e305): False -> False OK PASS s1=1 s2=1 (total: 65)
[00:44:42] Case 127 (s330/e846): False -> Uncertain X PASS s1=1 s2=1 (total: 66)
[00:47:06] Case 56 (s79/e242): Uncertain -> Uncertain OK PASS s1=1 s2=1 (total: 67)
[00:48:37] Case 55 (s79/e241): False -> False OK PASS s1=1 s2=2 (total: 68)
[00:50:10] Case 126 (s467/e1350): False -> Uncertain X FAIL@stage2 s1=1 s2=3 (total: 69)
[00:50:16] Case 201 (s101/e307): Uncertain -> Uncertain OK PASS s1=1 s2=1 (total: 70)
[00:51:54] Case 202 (s101/e308): Uncertain -> True X PASS s1=1 s2=2 (total: 71)
[00:52:26] Case 129 (s330/e848): Uncertain -> Uncertain OK PASS s1=1 s2=1 (total: 72)
[00:52:26] Case 128 (s330/e847): True -> Uncertain X PASS s1=1 s2=2 (total: 73)
[00:52:35] Case 200 (s101/e306): False -> False OK PASS s1=2 s2=2 (total: 74)
[00:54:00] Case 131 (s26/e74): True -> True OK PASS s1=1 s2=1 (total: 75)
[00:55:13] Case 59 (s2/e6): True -> True OK PASS s1=1 s2=1 (total: 76)
[00:55:20] Case 58 (s2/e5): Uncertain -> Uncertain OK PASS s1=1 s2=1 (total: 77)
[00:56:54] Case 130 (s330/e849): True -> False X PASS s1=1 s2=1 (total: 78)
[00:57:34] Case 60 (s192/e548): Uncertain -> Uncertain OK PASS s1=1 s2=1 (total: 79)
[00:58:56] Case 62 (s442/e1271): Uncertain -> Uncertain OK PASS s1=1 s2=1 (total: 80)
[00:59:15] Case 61 (s192/e549): Uncertain -> Uncertain OK PASS s1=1 s2=1 (total: 81)
[00:59:46] Case 134 (s203/e578): True -> True OK PASS s1=1 s2=1 (total: 82)
[01:01:18] Case 133 (s26/e76): Uncertain -> Uncertain OK PASS s1=1 s2=1 (total: 83)
[01:01:40] Case 132 (s26/e75): Uncertain -> False X PASS s1=1 s2=1 (total: 84)
[01:02:58] Case 135 (s203/e579): Uncertain -> Uncertain OK PASS s1=1 s2=1 (total: 85)
[01:03:43] Case 64 (s442/e1273): True -> True OK PASS s1=1 s2=2 (total: 86)
[01:04:04] Case 65 (s234/e663): True -> True OK PASS s1=1 s2=1 (total: 87)
[01:05:25] Case 136 (s203/e580): False -> True X PASS s1=1 s2=1 (total: 88)
[01:06:18] Case 66 (s234/e664): Uncertain -> None X FAIL@stage1 s1=3 s2=0 (total: 89)
[01:06:26] Case 137 (s131/e388): True -> True OK PASS s1=1 s2=2 (total: 90)
[01:06:30] Case 57 (s2/e4): False -> False OK FAIL@stage2 s1=2 s2=3 (total: 91)
[01:08:26] Case 68 (s120/e360): True -> True OK PASS s1=1 s2=1 (total: 92)
[01:08:35] Case 67 (s234/e665): True -> True OK PASS s1=1 s2=1 (total: 93)
[01:12:31] Case 139 (s460/e1327): Uncertain -> Uncertain OK PASS s1=1 s2=1 (total: 94)
[01:13:14] Case 63 (s442/e1272): False -> False OK FAIL@stage2 s1=1 s2=3 (total: 95)
[01:15:19] Case 70 (s322/e819): Uncertain -> True X PASS s1=1 s2=1 (total: 96)
[01:16:57] Case 141 (s460/e1329): True -> Uncertain X PASS s1=1 s2=1 (total: 97)
[01:18:14] Case 142 (s46/e133): True -> True OK PASS s1=1 s2=1 (total: 98)
[01:20:37] Case 140 (s460/e1328): False -> False OK PASS s1=1 s2=1 (total: 99)
[01:23:42] Case 69 (s120/e361): False -> Uncertain X PASS s1=2 s2=2 (total: 100)
[01:24:25] Case 138 (s131/e389): False -> False OK PASS s1=1 s2=3 (total: 101)
[01:25:34] Case 71 (s322/e820): False -> False OK FAIL@stage2 s1=1 s2=3 (total: 102)
[01:25:40] Case 73 (s83/e253): True -> True OK PASS s1=1 s2=1 (total: 103)
[01:26:01] Case 143 (s46/e134): Uncertain -> Uncertain OK PASS s1=1 s2=1 (total: 104)
[01:27:01] Case 144 (s483/e1410): Uncertain -> Uncertain OK PASS s1=1 s2=1 (total: 105)
[01:27:52] Case 72 (s322/e821): True -> True OK PASS s1=1 s2=1 (total: 106)
[01:29:33] Case 146 (s483/e1412): True -> True OK PASS s1=1 s2=1 (total: 107)
[01:30:35] Case 145 (s483/e1411): Uncertain -> Uncertain OK PASS s1=1 s2=1 (total: 108)
[01:31:08] Case 74 (s83/e254): False -> False OK PASS s1=1 s2=1 (total: 109)
[01:31:48] Case 0 (s380/e1014): Uncertain -> Uncertain OK PASS s1=1 s2=1 (total: 110)
[01:32:08] Case 75 (s368/e979): Uncertain -> True X PASS s1=1 s2=1 (total: 111)
[01:32:24] Case 147 (s483/e1413): True -> True OK PASS s1=1 s2=1 (total: 112)
[01:33:15] Case 1 (s380/e1015): True -> False X PASS s1=1 s2=1 (total: 113)
[01:37:37] Case 77 (s368/e981): False -> True X PASS s1=1 s2=1 (total: 114)
[01:37:44] Case 2 (s380/e1016): False -> False OK PASS s1=1 s2=1 (total: 115)
[01:37:58] Case 76 (s368/e980): True -> True OK PASS s1=1 s2=1 (total: 116)
[01:38:14] Case 3 (s426/e1208): Uncertain -> Uncertain OK PASS s1=1 s2=1 (total: 117)
[01:41:22] Case 78 (s319/e805): False -> False OK PASS s1=1 s2=1 (total: 118)
[01:41:53] Case 148 (s483/e1414): False -> False OK PASS s1=1 s2=2 (total: 119)
[01:42:40] Case 149 (s80/e243): True -> True OK PASS s1=1 s2=1 (total: 120)
[01:43:48] Case 79 (s319/e806): True -> True OK PASS s1=1 s2=1 (total: 121)
[01:44:45] Case 150 (s80/e244): Uncertain -> Uncertain OK PASS s1=1 s2=1 (total: 122)
[01:47:32] Case 6 (s198/e563): True -> True OK PASS s1=1 s2=1 (total: 123)
[01:51:21] Case 4 (s426/e1209): Uncertain -> False X PASS s1=1 s2=2 (total: 124)
[01:51:41] Case 151 (s80/e245): Uncertain -> Uncertain OK PASS s1=2 s2=1 (total: 125)
[01:51:49] Case 80 (s319/e807): Uncertain -> False X PASS s1=1 s2=2 (total: 126)
[01:53:58] Case 81 (s319/e808): True -> True OK PASS s1=1 s2=1 (total: 127)
[01:54:50] Case 7 (s198/e564): Uncertain -> False X PASS s1=1 s2=2 (total: 128)
[01:55:18] Case 5 (s426/e1210): True -> False X FAIL@stage2 s1=1 s2=3 (total: 129)
[01:56:24] Case 152 (s363/e964): Uncertain -> Uncertain OK PASS s1=1 s2=1 (total: 130)
[01:57:07] Case 153 (s363/e965): False -> False OK PASS s1=1 s2=1 (total: 131)
[01:58:31] Case 8 (s198/e565): Uncertain -> Uncertain OK PASS s1=1 s2=1 (total: 132)
[01:59:10] Case 154 (s363/e966): True -> True OK PASS s1=1 s2=1 (total: 133)
[02:00:00] Case 83 (s306/e754): False -> True X PASS s1=1 s2=1 (total: 134)
[02:02:02] Case 155 (s258/e702): Uncertain -> Uncertain OK PASS s1=1 s2=1 (total: 135)
[02:02:17] Case 84 (s306/e755): True -> True OK PASS s1=1 s2=1 (total: 136)
[02:02:17] Case 9 (s0/e0): True -> True OK PASS s1=1 s2=3 (total: 137)
[02:07:44] Case 11 (s0/e2): Uncertain -> Uncertain OK PASS s1=1 s2=1 (total: 138)
[02:08:02] Case 82 (s319/e809): False -> False OK FAIL@stage2 s1=1 s2=3 (total: 139)
[02:09:03] Case 156 (s435/e1244): False -> False OK PASS s1=1 s2=1 (total: 140)
[02:09:29] Case 12 (s20/e57): True -> True OK PASS s1=1 s2=1 (total: 141)
[02:10:31] Case 157 (s435/e1245): True -> True OK PASS s1=1 s2=1 (total: 142)
[02:12:33] Case 13 (s20/e58): Uncertain -> Uncertain OK PASS s1=1 s2=1 (total: 143)
[02:14:09] Case 87 (s58/e171): True -> True OK PASS s1=1 s2=1 (total: 144)
[02:14:11] Case 10 (s0/e1): False -> False OK FAIL@stage2 s1=1 s2=3 (total: 145)
[02:14:33] Case 158 (s435/e1246): True -> True OK PASS s1=1 s2=1 (total: 146)
[02:15:26] Case 85 (s306/e756): Uncertain -> Uncertain OK FAIL@stage2 s1=1 s2=3 (total: 147)
[02:15:51] Case 86 (s245/e688): True -> True OK PASS s1=1 s2=1 (total: 148)
[02:16:08] Case 15 (s282/e726): True -> True OK PASS s1=1 s2=1 (total: 149)
[02:17:26] Case 88 (s58/e172): True -> True OK PASS s1=1 s2=1 (total: 150)
[02:17:57] Case 160 (s217/e618): True -> True OK PASS s1=1 s2=1 (total: 151)
[02:18:14] Case 159 (s435/e1247): Uncertain -> True X PASS s1=1 s2=1 (total: 152)
[02:19:27] Case 90 (s191/e546): True -> True OK PASS s1=1 s2=1 (total: 153)
[02:20:24] Case 89 (s58/e173): Uncertain -> True X PASS s1=1 s2=1 (total: 154)
[02:22:55] Case 161 (s217/e619): Uncertain -> False X PASS s1=1 s2=1 (total: 155)
[02:25:22] Case 16 (s471/e1361): Uncertain -> Uncertain OK PASS s1=1 s2=1 (total: 156)
[02:26:41] Case 17 (s471/e1362): Uncertain -> Uncertain OK PASS s1=1 s2=1 (total: 157)
[02:27:19] Case 91 (s191/e547): False -> Uncertain X PASS s1=1 s2=1 (total: 158)
[02:28:05] Case 18 (s471/e1363): True -> True OK PASS s1=1 s2=1 (total: 159)
[02:29:49] Case 14 (s20/e59): False -> True X FAIL@stage2 s1=1 s2=3 (total: 160)
[02:30:19] Case 163 (s318/e802): Uncertain -> Uncertain OK PASS s1=1 s2=1 (total: 161)
[02:31:54] Case 19 (s471/e1364): True -> True OK PASS s1=1 s2=1 (total: 162)
[02:32:14] Case 162 (s292/e736): False -> False OK FAIL@stage2 s1=1 s2=3 (total: 163)
[02:33:55] Case 92 (s166/e476): False -> Uncertain X PASS s1=1 s2=1 (total: 164)
[02:34:01] Case 165 (s318/e804): True -> True OK PASS s1=1 s2=1 (total: 165)
[02:34:57] Case 21 (s184/e530): True -> True OK PASS s1=1 s2=1 (total: 166)
[02:36:52] Case 166 (s107/e323): True -> True OK PASS s1=1 s2=1 (total: 167)
[02:39:03] Case 164 (s318/e803): False -> False OK FAIL@stage2 s1=1 s2=3 (total: 168)
[02:39:53] Case 95 (s352/e933): Uncertain -> False X PASS s1=1 s2=1 (total: 169)
[02:40:58] Case 93 (s166/e477): Uncertain -> Uncertain OK PASS s1=1 s2=1 (total: 170)
[02:41:41] Case 167 (s107/e324): True -> True OK PASS s1=1 s2=1 (total: 171)
[02:42:37] Case 94 (s166/e478): True -> True OK PASS s1=2 s2=1 (total: 172)
[02:43:37] Case 96 (s352/e934): False -> False OK PASS s1=1 s2=2 (total: 173)
[02:45:15] Case 97 (s352/e935): True -> True OK PASS s1=1 s2=1 (total: 174)
[02:45:34] Case 168 (s107/e325): False -> False OK PASS s1=1 s2=1 (total: 175)
[02:45:54] Case 22 (s184/e531): False -> False OK PASS s1=1 s2=2 (total: 176)
[02:48:52] Case 20 (s471/e1365): False -> False OK FAIL@stage2 s1=1 s2=3 (total: 177)
[02:49:07] Case 24 (s232/e657): True -> True OK PASS s1=1 s2=1 (total: 178)
[02:49:47] Case 98 (s472/e1366): Uncertain -> Uncertain OK PASS s1=1 s2=1 (total: 179)
[02:51:09] Case 23 (s184/e532): Uncertain -> Uncertain OK PASS s1=2 s2=1 (total: 180)
[02:52:18] Case 169 (s386/e1032): Uncertain -> Uncertain OK PASS s1=1 s2=1 (total: 181)
[02:52:33] Case 26 (s232/e659): Uncertain -> Uncertain OK PASS s1=1 s2=1 (total: 182)
[02:52:33] Case 170 (s386/e1033): True -> True OK PASS s1=1 s2=1 (total: 183)
[02:52:42] Case 25 (s232/e658): Uncertain -> Uncertain OK PASS s1=1 s2=1 (total: 184)
[02:53:24] Case 99 (s472/e1367): True -> True OK PASS s1=1 s2=1 (total: 185)
[02:55:13] Case 171 (s386/e1034): False -> False OK PASS s1=1 s2=1 (total: 186)
[02:58:44] Case 27 (s452/e1301): Uncertain -> Uncertain OK PASS s1=1 s2=1 (total: 187)
[02:59:53] Case 101 (s379/e1011): Uncertain -> False X PASS s1=1 s2=1 (total: 188)
[03:00:23] Case 172 (s355/e941): Uncertain -> Uncertain OK FAIL@stage2 s1=1 s2=3 (total: 189)
[03:02:08] Case 28 (s452/e1302): True -> True OK PASS s1=1 s2=1 (total: 190)
[03:03:18] Case 100 (s472/e1368): False -> False OK PASS s1=1 s2=3 (total: 191)
[03:05:11] Case 174 (s355/e943): True -> True OK PASS s1=1 s2=1 (total: 192)
[03:06:12] Case 177 (s51/e149): True -> None X FAIL@stage1 s1=3 s2=0 (total: 193)
[03:06:36] Case 173 (s355/e942): False -> False OK PASS s1=1 s2=2 (total: 194)
[03:08:28] Case 103 (s379/e1013): True -> False X PASS s1=1 s2=1 (total: 195)
[03:10:26] Case 104 (s197/e560): True -> True OK PASS s1=1 s2=1 (total: 196)
[03:10:36] Case 175 (s51/e147): Uncertain -> Uncertain OK PASS s1=1 s2=1 (total: 197)
[03:10:58] Case 102 (s379/e1012): False -> True X FAIL@stage2 s1=1 s2=3 (total: 198)
[03:11:52] Case 31 (s340/e894): True -> True OK PASS s1=1 s2=1 (total: 199)
[03:12:18] Case 30 (s340/e893): Uncertain -> False X PASS s1=1 s2=2 (total: 200)
[03:15:09] Case 29 (s452/e1303): False -> True X FAIL@stage2 s1=1 s2=3 (total: 201)
[03:19:05] Case 176 (s51/e148): False -> False OK FAIL@stage2 s1=2 s2=3 (total: 202)
[03:23:32] Case 32 (s340/e895): False -> Uncertain X FAIL@stage2 s1=1 s2=3 (total: 203)

======================================================================
FINAL RESULTS
======================================================================

Total: 203
Accuracy: 148/203 (72.9%)
Stage 1 Success: 201/203 (99.0%)
Stage 2 Success: 171/201 (85.1%)
Stage 1 Failures: 2
Stage 2 Failures: 30

Completed at: 2025-12-27 03:23:32
